項次,熱點類別,熱點名稱,郵遞區號,縣市名稱,鄉鎮市區,地址,熱點類別_英語,熱點名稱_英語,縣市名稱_英語,鄉鎮市區_英語,地址_英語
524,其他,全家便利商店北屯北屯路大向店(公話),406,臺中市,北屯區,臺中市北屯區北屯路210號之3,Others,"Family Mart convenience store, Beitun Rd., Beitun Dist., Taichung City ",Taichung City,Beitun District,"No.210-3, Beitun Rd., Beitun Dist., Taichung City 406, Taiwan (R.O.C.)"
525,其他,統一超商北屯北屯路寶昇店(公話),406,臺中市,北屯區,臺中市北屯區北屯路224號之1,Others,"7-Eleven convenience store, Beitun Rd., Beitun Dist., Taichung City ",Taichung City,Beitun District,"No.224-1, Beitun Rd., Beitun Dist., Taichung City 406, Taiwan (R.O.C.)"
526,其他,統一超商北屯北屯路昌順店(公話),406,臺中市,北屯區,臺中市北屯區北屯路439號之16,Others,"7-Eleven convenience store, Beitun Rd., Beitun Dist., Taichung City",Taichung City,Beitun District,"No.439-16, Beitun Rd., Beitun Dist., Taichung City 406, Taiwan (R.O.C.)"
527,其他,統一超商北屯北平路遠平店公話,406,臺中市,北屯區,臺中市北屯區北平路三段75號之4,Others,"7-Eleven convenience store, Sec. 3, Beiping Rd., Beitun Dist., Taichung City",Taichung City,Beitun District,"No.75-4, Sec. 3, Beiping Rd., Beitun Dist., Taichung City 406, Taiwan (R.O.C.)"
528,其他,統一超商北屯四平路松豪店(公話),406,臺中市,北屯區,臺中市北屯區四平路218號,Others,"7-Eleven convenience store, Siping Rd., Beitun Dist., Taichung City",Taichung City,Beitun District,"No.218, Siping Rd., Beitun Dist., Taichung City 406, Taiwan (R.O.C.)"
529,其他,全家便利商店北區五權路五權一店(公話),404,臺中市,北區,臺中市北區五權路356號,Others,"Family Mart convenience store, No. 356, Wuquan Rd., North Dist., Taichung City",Taichung City,North District,"No. 356, Wuquan Rd., North Dist., Taichung City 404, Taiwan (R.O.C.)"
530,其他,統一超商北屯同榮路同榮店(公話),406,臺中市,北屯區,臺中市北屯區同榮路161號,Others,"7-Eleven convenience store, Tongrong Rd., Beitun Dist., Taichung City",Taichung City,Beitun District,"No.161, Tongrong Rd., Beitun Dist., Taichung City 406, Taiwan (R.O.C.)"
531,其他,統一超商霧峰吉峰東路朝陽大學店(公話),413,臺中市,霧峰區,臺中市霧峰區吉峰東路62號,Others,"7-Eleven convenience store, Jifeng E. Rd., Wufeng Dist., Taichung City",Taichung City,Wufeng District,"No. 62, Jifeng E. Rd., Wufeng Dist., Taichung City 413, Taiwan (R.O.C.)"
532,其他,全家便利商店北屯昌平東二路仁美店(公話),406,臺中市,北屯區,臺中市北屯區昌平東二路179號,Others,"Family Mart convenience store, Changping E. 2nd Rd., Beitun Dist., Taichung City",Taichung City,Beitun District,"No.179, Changping E. 2nd Rd., Beitun Dist., Taichung City 406, Taiwan (R.O.C.)"
533,其他,統一超商北屯昌平路昌陽店(公話),406,臺中市,北屯區,臺中市北屯區昌平路一段264號,Others,"7-Eleven convenience store, Sec. 1, Changping Rd., Beitun Dist., Taichung City",Taichung City,Beitun District,"No.264, Sec. 1, Changping Rd., Beitun Dist., Taichung City 406, Taiwan (R.O.C.)"
534,其他,統一超商北屯昌平路松竹店(公話),406,臺中市,北屯區,臺中市北屯區昌平路二段11號之1,Others,"7-Eleven convenience store, Sec. 2, Changping Rd., Beitun Dist., Taichung City",Taichung City,Beitun District,"No.11-1, Sec. 2, Changping Rd., Beitun Dist., Taichung City 406, Taiwan (R.O.C.)"
535,其他,統一超商北屯昌平路昌旺店(公話),406,臺中市,北屯區,臺中市北屯區昌平路二段12號之16,Others,"7-Eleven convenience store, Sec. 2, Changping Rd., Beitun Dist., Taichung City",Taichung City,Beitun District,"No.12-16, Sec. 2, Changping Rd., Beitun Dist., Taichung City 406, Taiwan (R.O.C.)"
536,其他,統一超商北屯昌平路昌盛店(公話),406,臺中市,北屯區,臺中市北屯區昌平路二段45號之9,Others,"7-Eleven convenience store, Sec. 2, Changping Rd., Beitun Dist., Taichung City",Taichung City,Beitun District,"No.45-9, Sec. 2, Changping Rd., Beitun Dist., Taichung City 406, Taiwan (R.O.C.)"
537,其他,全家便利商店北屯東山路水景店(公話),406,臺中市,北屯區,臺中市北屯區東山路一段196號之2,Others,"Family Mart convenience store, Sec. 1, Dongshan Rd., Beitun Dist., Taichung City",Taichung City,Beitun District,"No.196-2, Sec. 1, Dongshan Rd., Beitun Dist., Taichung City 406, Taiwan (R.O.C.)"
538,其他,統一超商北屯東山路水景店(公話),406,臺中市,北屯區,臺中市北屯區東山路一段212號,Others,"7-Eleven convenience store, Sec. 1, Dongshan Rd., Beitun Dist., Taichung City",Taichung City,Beitun District,"No.221, Sec. 1, Dongshan Rd., Beitun Dist., Taichung City 406, Taiwan (R.O.C.)"
539,其他,萊爾富便利商店北屯東山路大坑口店(公話),406,臺中市,北屯區,臺中市北屯區東山路一段35號,Others,"Hi-Life convenience store, Sec. 1, Dongshan Rd., Beitun Dist., Taichung City",Taichung City,Beitun District,"No.35, Sec. 1, Dongshan Rd., Beitun Dist., Taichung City 406, Taiwan (R.O.C.)"
540,其他,統一超商北屯東山路東侑店(公話),406,臺中市,北屯區,臺中市北屯區東山路一段396號,Others,"7-Eleven convenience store,Sec. 1, Dongshan Rd., Beitun Dist., Taichung City",Taichung City,Beitun District,"No.396, Sec. 1, Dongshan Rd., Beitun Dist., Taichung City 406, Taiwan (R.O.C.)"
541,其他,統一超商北屯東山路天星店(公話),406,臺中市,北屯區,臺中市北屯區東山路二段77號之9,Others,"7-Eleven convenience store,Sec. 2, Dongshan Rd., Beitun Dist., Taichung City",Taichung City,Beitun District,"No.77-9, Sec. 2, Dongshan Rd., Beitun Dist., Taichung City 406, Taiwan (R.O.C.)"
542,其他,統一超商北屯東山路博吉店(公話),406,臺中市,北屯區,臺中市北屯區東光路786號,Others,"7-Eleven convenience store,Dongguang Rd., Beitun Dist., Taichung City",Taichung City,Beitun District,"No.786, Dongguang Rd., Beitun Dist., Taichung City 406, Taiwan (R.O.C.)"
543,其他,全家便利商店太平中山路中華店(公話),411,臺中市,太平區,臺中市太平區中山路二段441號,Others,"Family Mart convenience store,No. 441, Sec. 2, Zhongshan Rd., Taiping Dist., Taichung City",Taichung City,Taiping District,"No. 441, Sec. 2, Zhongshan Rd., Taiping Dist., Taichung City 411, Taiwan (R.O.C.)"
544,其他,統一超商北屯松竹五路軍松店(公話),406,臺中市,北屯區,臺中市北屯區松竹五路199號,Others,"7-Eleven convenience store,Songzhu 5th Rd., Beitun Dist., Taichung City",Taichung City,Beitun District,"No.199, Songzhu 5th Rd., Beitun Dist., Taichung City 406, Taiwan (R.O.C.)"
545,其他,全家便利商店北屯和順路和順店(公話),406,臺中市,北屯區,臺中市北屯區和順路400號,Others,"Family Mart convenience store, Heshun Rd., Beitun Dist., Taichung City",Taichung City,Beitun District,"No.400, Heshun Rd., Beitun Dist., Taichung City 406, Taiwan (R.O.C.)"
546,其他,全家便利商店北屯北屯路北新店(公話),406,臺中市,北屯區,臺中市北屯區北屯路288號,Others,"Family Mart convenience store, No. 288, Beitun Rd., Beitun Dist., Taichung City",Taichung City,Beitun District,"No. 288, Beitun Rd., Beitun Dist., Taichung City 406, Taiwan (R.O.C.)"
547,其他,全家便利商店北屯松竹路金強店(公話),406,臺中市,北屯區,臺中市北屯區松竹路二段366號之1,Others,"Family Mart convenience store,Sec. 2, Songzhu Rd., Beitun Dist., Taichung City",Taichung City,Beitun District,"No.366-1, Sec. 2, Songzhu Rd., Beitun Dist., Taichung City 406, Taiwan (R.O.C.)"
548,其他,統一超商北屯松竹路雅樂店(公話),406,臺中市,北屯區,臺中市北屯區松竹路二段88號1樓,Others,"7-Eleven convenience store,Sec. 2, Songzhu Rd., Beitun Dist., Taichung City",Taichung City,Beitun District,"1F., No.88, Sec. 2, Songzhu Rd., Beitun Dist., Taichung City 406, Taiwan (R.O.C.)"
549,其他,統一超商北屯松竹路松東店(公話),406,臺中市,北屯區,臺中市北屯區松竹路三段125號,Others,"7-Eleven convenience store,Sec. 3, Songzhu Rd., Beitun Dist., Taichung City",Taichung City,Beitun District,"No.125, Sec. 3, Songzhu Rd., Beitun Dist., Taichung City 406, Taiwan (R.O.C.)"
550,其他,全家便利商店北屯松義街真義店(公話),406,臺中市,北屯區,臺中市北屯區松義街166號,Others,"Family Mart convenience store,Songyi St., Beitun Dist., Taichung City",Taichung City,Beitun District,"No.166, Songyi St., Beitun Dist., Taichung City 406, Taiwan (R.O.C.)"
551,其他,統一超商北屯河北路連河店(公話),406,臺中市,北屯區,臺中市北屯區河北路二段218號之1,Others,"7-Eleven convenience store,Sec. 2, Hebei Rd., Beitun Dist., Taichung City",Taichung City,Beitun District,"No.218-1, Sec. 2, Hebei Rd., Beitun Dist., Taichung City 406, Taiwan (R.O.C.)"
552,其他,全家便利商店北屯河北路金河店(公話),406,臺中市,北屯區,臺中市北屯區河北路二段98號,Others,"Family Mart convenience store,Sec. 2, Hebei Rd., Beitun Dist., Taichung City",Taichung City,Beitun District,"No.98, Sec. 2, Hebei Rd., Beitun Dist., Taichung City 406, Taiwan (R.O.C.)"
553,其他,統一超商北屯青島路青河店(公話),406,臺中市,北屯區,臺中市北屯區青島路三段155號,Others,"7-Eleven convenience store, Sec. 3, Qingdao Rd., Beitun Dist., Taichung City",Taichung City,Beitun District,"No.155, Sec. 3, Qingdao Rd., Beitun Dist., Taichung City 406, Taiwan (R.O.C.)"
554,其他,統一超商北屯軍功路松潭店(公話),406,臺中市,北屯區,臺中市北屯區軍功路2段183號,Others,"7-Eleven convenience store,Sec. 2, Jungong Rd., Beitun Dist., Taichung City",Taichung City,Beitun District,"No.183, Sec. 2, Jungong Rd., Beitun Dist., Taichung City 406, Taiwan (R.O.C.)"
555,其他,全家便利商店北屯軍功路軍功店(公話),406,臺中市,北屯區,臺中市北屯區軍功路一段497號,Others,"Family Mart convenience store,Sec. 1, Jungong Rd., Beitun Dist., Taichung City",Taichung City,Beitun District,"No.497, Sec. 1, Jungong Rd., Beitun Dist., Taichung City 406, Taiwan (R.O.C.)"
556,其他,統一超商北屯軍功路軍福店(公話),406,臺中市,北屯區,臺中市北屯區軍功路一段500號,Others,"7-Eleven convenience store,Sec. 1, Jungong Rd., Beitun Dist., Taichung City",Taichung City,Beitun District,"No.500, Sec. 1, Jungong Rd., Beitun Dist., Taichung City 406, Taiwan (R.O.C.)"
557,其他,統一超商北屯國校巷國校店(公話),406,臺中市,北屯區,臺中市北屯區國校巷16號1樓,Others,"7-Eleven convenience store,Guoxiao Ln., Beitun Dist., Taichung City",Taichung City,Beitun District,"1F., No.16, Guoxiao Ln., Beitun Dist., Taichung City 406, Taiwan (R.O.C.)"
558,其他,全家便利商店北屯崇德二路昌盛店(公話),406,臺中市,北屯區,臺中市北屯區崇德二路一段259號,Others,"Family Mart convenience store,Sec. 1, Chongde 2nd Rd., Beitun Dist., Taichung City",Taichung City,Beitun District,"No.259, Sec. 1, Chongde 2nd Rd., Beitun Dist., Taichung City 406, Taiwan (R.O.C.)"
559,其他,統一超商北屯崇德六路松強店(公話),406,臺中市,北屯區,臺中市北屯區崇德六路一段47號,Others,"7-Eleven convenience store,Sec. 1, Chongde 6th Rd., Beitun Dist., Taichung City",Taichung City,Beitun District,"No.47, Sec. 1, Chongde 6th Rd., Beitun Dist., Taichung City 406, Taiwan (R.O.C.)"
560,其他,統一超商梧棲大智路詠珊店(公話),435,臺中市,梧棲區,臺中市梧棲區大智路1017號,Others,"7-Eleven convenience store, Dazhi Rd., Wuqi Dist., Taichung City",Taichung City,Wuqi District,"No. 1017, Dazhi Rd., Wuqi Dist., Taichung City 435, Taiwan (R.O.C.)"
561,其他,全家便利商店北屯崇德路崇德店(公話),406,臺中市,北屯區,臺中市北屯區崇德路二段351號,Others,"Family Mart convenience store,Sec. 2, Chongde 2nd Rd., Beitun Dist., Taichung City",Taichung City,Beitun District,"No.351, Sec. 2, Chongde 2nd Rd., Beitun Dist., Taichung City 406, Taiwan (R.O.C.)"
562,其他,統一超商北屯區后庄路后庄店(公話),406,臺中市,北屯區,臺中市北屯區后庄路141號,Others,"7-Eleven convenience store, No. 141, Houzhuang Rd., Beitun Dist., Taichung City",Taichung City,Beitun District,"No. 141, Houzhuang Rd., Beitun Dist., Taichung City 406, Taiwan (R.O.C.)"
563,其他,統一超商北屯崇德路豐樂店(公話),406,臺中市,北屯區,臺中市北屯區崇德路三段608號,Others,"7-Eleven convenience store,Sec. 3, Chongde Rd., Beitun Dist., Taichung City",Taichung City,Beitun District,"No.608, Sec. 3, Chongde Rd., Beitun Dist., Taichung City 406, Taiwan (R.O.C.)"
564,其他,OK超商北屯梅川東路梅川店(公話),406,臺中市,北屯區,臺中市北屯區梅川東路四段102號,Others,"OK mart convenience store,Sec. 4, Meichuan E. Rd., Beitun Dist., Taichung City",Taichung City,Beitun District,"No.102, Sec. 4, Meichuan E. Rd., Beitun Dist., Taichung City 406, Taiwan (R.O.C.)"
565,其他,統一超商北屯陳平路福寶店(公話),406,臺中市,北屯區,臺中市北屯區陳平路50號,Others,"7-Eleven convenience store,Chenping Rd., Beitun Dist., Taichung City",Taichung City,Beitun District,"No.50, Chenping Rd., Beitun Dist., Taichung City 406, Taiwan (R.O.C.)"
566,其他,統一超商北屯敦化路敦煌店(公話),406,臺中市,北屯區,臺中市北屯區敦化路456號,Others,"7-Eleven convenience store,Sec. 1, Dunhua Rd., Beitun Dist., Taichung City",Taichung City,Beitun District,"No.456, Sec. 1, Dunhua Rd., Beitun Dist., Taichung City 406, Taiwan (R.O.C.)"
567,其他,OK超商北屯綏遠路綏遠店(公話),406,臺中市,北屯區,臺中市北屯區綏遠路二段216號,Others,"OK mart convenience store,Sec. 2, Suiyuan Rd., Beitun Dist., Taichung City",Taichung City,Beitun District,"No.216, Sec. 2, Suiyuan Rd., Beitun Dist., Taichung City 406, Taiwan (R.O.C.)"
568,其他,全家便利商店北屯熱河路熱河店(公話),406,臺中市,北屯區,臺中市北屯區熱河路二段164號,Others,"Family Mart convenience store,Sec. 2, Rehe Rd., Beitun Dist., Taichung City ",Taichung City,Beitun District,"No.164, Sec. 2, Rehe Rd., Beitun Dist., Taichung City 406, Taiwan (R.O.C.)"
569,其他,全家便利商店北屯熱河路崇河店(公話),406,臺中市,北屯區,臺中市北屯區熱河路三段57號,Others,"Family Mart convenience store,Sec. 3, Rehe Rd., Beitun Dist., Taichung City ",Taichung City,Beitun District,"No.57, Sec. 3, Rehe Rd., Beitun Dist., Taichung City 406, Taiwan (R.O.C.)"
570,其他,全家便利商店北屯興安路鼎安店(公話),406,臺中市,北屯區,臺中市北屯區興安路一段235號,Others,"Family Mart convenience store,Sec. 1, Xing’an Rd., Beitun Dist., Taichung City ",Taichung City,Beitun District,"No.235, Sec. 1, Xing’an Rd., Beitun Dist., Taichung City 406, Taiwan (R.O.C.)"
571,其他,統一超商北屯興安路新興陽店(公話),406,臺中市,北屯區,臺中市北屯區興安路一段299號,Others,"7-Eleven convenience store,Sec. 1, Xing’an Rd., Beitun Dist., Taichung City",Taichung City,Beitun District,"No.299, Sec. 1, Xing’an Rd., Beitun Dist., Taichung City 406, Taiwan (R.O.C.)"
572,其他,全家便利商店北屯興安路興安路店(公話),406,臺中市,北屯區,臺中市北屯區興安路二段3號,Others,"Family Mart convenience store,Sec. 2, Xing’an Rd., Beitun Dist., Taichung City ",Taichung City,Beitun District,"No.3, Sec. 2, Xing’an Rd., Beitun Dist., Taichung City 406, Taiwan (R.O.C.)"
573,其他,全家便利商店北屯興安路松茂店(公話),406,臺中市,北屯區,臺中市北屯區興安路二段463號,Others,"Family Mart convenience store, Sec. 2, Xing’an Rd., Beitun Dist., Taichung City",Taichung City,Beitun District,"No.463, Sec. 2, Xing’an Rd., Beitun Dist., Taichung City 406, Taiwan (R.O.C.)"
574,其他,統一超商北屯興安路興昌店(公話),406,臺中市,北屯區,臺中市北屯區興安路二段60號,Others,"7-Eleven convenience store,Sec. 2, Xing’an Rd., Beitun Dist., Taichung City ",Taichung City,Beitun District,"No.60, Sec. 2, Xing’an Rd., Beitun Dist., Taichung City 406, Taiwan (R.O.C.)"
575,其他,全家便利商店北屯遼寧路遼寧店(公話),406,臺中市,北屯區,臺中市北屯區遼寧路一段158號,Others,"Family Mart convenience store,Sec. 1, Liaoning Rd., Beitun Dist., Taichung City ",Taichung City,Beitun District,"No.158, Sec. 1, Liaoning Rd., Beitun Dist., Taichung City 406, Taiwan (R.O.C.)"
576,其他,統一超商北屯瀋陽路瀋陽店(公話),406,臺中市,北屯區,臺中市北屯區瀋陽路一段104號,Others,"7-Eleven convenience store,Sec. 1, Shenyang Rd., Beitun Dist., Taichung City ",Taichung City,Beitun District,"No.104, Sec. 1, Shenyang Rd., Beitun Dist., Taichung City 406, Taiwan (R.O.C.)"
577,其他,統一超商北區三民路錦中店(公話),404,臺中市,北區,臺中市北區三民路三段258號,Others,"7-Eleven convenience store,Sec. 3, Sanmin Rd., North Dist., Taichung City",Taichung City,North District,"No.258, Sec. 3, Sanmin Rd., North Dist., Taichung City 404, Taiwan (R.O.C.)"
578,其他,統一超商北區中清路雅昌店(公話),404,臺中市,北區,臺中市北區中清路一段569號,Others,"7-Eleven convenience store, No. 569, Sec. 1, Zhongqing Rd., North Dist., Taichung City",Taichung City,North District,"No. 569, Sec. 1, Zhongqing Rd., North Dist., Taichung City 404, Taiwan (R.O.C.)"
579,其他,統一超商北區山西路昌鴻店(公話),404,臺中市,北區,臺中市北區山西路1段48號,Others,"7-Eleven convenience store,Sec. 1, Shanxi Rd., North Dist., Taichung City",Taichung City,North District,"No.48, Sec. 1, Shanxi Rd., North Dist., Taichung City 404, Taiwan (R.O.C.)"
580,其他,統一超商西屯青海路逢科店(公話),407,臺中市,西屯區,臺中市西屯區青海路二段556號,Others,"7-Eleven convenience store, Sec. 2, Qinghai Rd., Xitun Dist., Taichung City",Taichung City,Xitun District,"No. 556, Sec. 2, Qinghai Rd., Xitun Dist., Taichung City 407, Taiwan (R.O.C.)"
581,其他,統一超商北區中清路亞太店(公話),404,臺中市,北區,臺中市北區中清路一段508號,Others,"7-Eleven convenience store,Sec. 1, Zhongqing Rd., North Dist., Taichung City",Taichung City,North District,"No.508, Sec. 1, Zhongqing Rd., North Dist., Taichung City 404, Taiwan (R.O.C.)"
582,其他,全家便利商店北區中清路高雅店(公話),404,臺中市,北區,臺中市北區中清路一段720號,Others,"Family Mart convenience store,Sec. 1, Zhongqing Rd., North Dist., Taichung City ",Taichung City,North District,"No.720, Sec. 1, Zhongqing Rd., North Dist., Taichung City 404, Taiwan (R.O.C.)"
583,其他,統一超商北區中華路華太店(公話),404,臺中市,北區,臺中市北區中華路二段137號,Others,"7-Eleven convenience store,Sec. 2, Zhonghua Rd., North Dist., Taichung City",Taichung City,North District,"No.137, Sec. 2, Zhonghua Rd., North Dist., Taichung City 404, Taiwan (R.O.C.)"
584,其他,全家便利商店北區五義街五億店(公話),404,臺中市,北區,臺中市北區五義街130號,Others,"Family Mart convenience store,Wuyi St., North Dist., Taichung City ",Taichung City,North District,"No.130, Wuyi St., North Dist., Taichung City 404, Taiwan (R.O.C.)"
585,其他,全家便利商店北區太原路太陽店(公話),404,臺中市,北區,臺中市北區太原路一段450號之1,Others,"Family Mart convenience store,Sec. 1, Taiyuan Rd., North Dist., Taichung City ",Taichung City,North District,"No.450-1, Sec. 1, Taiyuan Rd., North Dist., Taichung City 404, Taiwan (R.O.C.)"
586,其他,統一超商北區日興街光大國宅店(公話),404,臺中市,北區,臺中市北區日興街180號,Others,"7-Eleven convenience store,Rixing St., North Dist., Taichung City",Taichung City,North District,"No.180, Rixing St., North Dist., Taichung City 404, Taiwan (R.O.C.)"
587,其他,全家便利商店北區北屯路北屯店(公話),404,臺中市,北區,臺中市北區北屯路45號,Others,"Family Mart convenience store, Beitun Rd., North Dist., Taichung City ",Taichung City,North District,"No.45, Beitun Rd., North Dist., Taichung City 404, Taiwan (R.O.C.)"
588,其他,統一超商北區北平路東義店(公話),404,臺中市,北區,臺中市北區北平路二段141號,Others,"7-Eleven convenience store,Sec. 2, Beiping Rd., North Dist., Taichung City",Taichung City,North District,"No.141, Sec. 2, Beiping Rd., North Dist., Taichung City 404, Taiwan (R.O.C.)"
589,其他,全家便利商店台中北平路嘉農店(公話),404,臺中市,北區,臺中市北區北平路二段8號,Others,"Family Mart convenience store,Sec. 2, Beiping Rd., North Dist., Taichung City ",Taichung City,North District,"No.8, Sec. 2, Beiping Rd., North Dist., Taichung City 404, Taiwan (R.O.C.)"
590,其他,全家便利商店南屯大墩十一街墩鴻店(公話),408,臺中市,南屯區,臺中市南屯區大墩十一街290號,Others,"Family Mart convenience store, Dadun 11th St., Nantun Dist., Taichung City",Taichung City,Nantun District,"No.290, Dadun 11th St., Nantun Dist., Taichung City 408, Taiwan (R.O.C.)"
591,其他,統一超商北區自強一街合作店(公話),404,臺中市,北區,臺中市北區自強一街1號,Others,"7-Eleven convenience store,Ziqiang 1st St., North Dist., Taichung",Taichung City,North District,"No.1, Ziqiang 1st St., North Dist., Taichung City 404, Taiwan (R.O.C.)"
592,其他,統一超商北區育才北路中友店(公話),404,臺中市,北區,臺中市北區育才北路74號,Others,"7-Eleven convenience store,Yucai N. Rd., North Dist., Taichung City",Taichung City,North District,"No.74, Yucai N. Rd., North Dist., Taichung City 404, Taiwan (R.O.C.)"
593,其他,統一超商北區育德路中醫店(公話),404,臺中市,北區,臺中市北區育德路13號,Others,"7-Eleven convenience store,Yude Rd., North Dist., Taichung City",Taichung City,North District,"No.13, Yude Rd., North Dist., Taichung City 404, Taiwan (R.O.C.)"
594,其他,統一超商北區忠明路忠權店(公話),404,臺中市,北區,臺中市北區忠明路424號,Others,"7-Eleven convenience store, Zhongming Rd., North Dist., Taichung City ",Taichung City,North District,"No.424, Zhongming Rd., North Dist., Taichung City 404, Taiwan (R.O.C.)"
595,其他,全家便利商店北區東成路東成店(公話),404,臺中市,北區,臺中市北區東成路20號,Others,"Family Mart convenience store,Dongcheng Rd., North Dist., Taichung City ",Taichung City,North District,"No.20, Dongcheng Rd., North Dist., Taichung City 404, Taiwan (R.O.C.)"
596,其他,全家便利商店北區青島路新東義店(公話),404,臺中市,北區,臺中市北區青島路一段12號,Others,"Family Mart convenience store,Sec. 1, Qingdao Rd., North Dist., Taichung City ",Taichung City,North District,"No.12, Sec. 1, Qingdao Rd., North Dist., Taichung City 404, Taiwan (R.O.C.)"
597,其他,全家便利商店北區陝西路福多店(公話),404,臺中市,北區,臺中市北區陝西路63號,Others,"Family Mart convenience store,Shanxi Rd., North Dist., Taichung City ",Taichung City,North District,"No.63, Shanxi Rd., North Dist., Taichung City 404, Taiwan (R.O.C.)"
598,其他,統一超商北區健行路益華店(公話),404,臺中市,北區,臺中市北區健行路49號,Others,"7-Eleven convenience store, Jianxing Rd., North Dist., Taichung City",Taichung City,North District,"No.49, Jianxing Rd., North Dist., Taichung City 404, Taiwan (R.O.C.)"
599,其他,全家便利商店北區健行路健興店(公話),404,臺中市,北區,臺中市北區健行路786號,Others,"Family Mart convenience store,Jianxing Rd., North Dist., Taichung City ",Taichung City,North District,"No.786, Jianxing Rd., North Dist., Taichung City 404, Taiwan (R.O.C.)"
600,其他,統一超商北區崇德路庚樺店(公話),404,臺中市,北區,臺中市北區崇德路一段143號之2,Others,"7-Eleven convenience store,Sec. 1, Chongde Rd., North Dist., Taichung City",Taichung City,North District,"No.143-2, Sec. 1, Chongde Rd., North Dist., Taichung City 404, Taiwan (R.O.C.)"
601,其他,全家便利商店北區進化北路進學店(公話),404,臺中市,北區,臺中市北區進化北路325號,Others,"Family Mart convenience store, Jinhua N. Rd., North Dist., Taichung City",Taichung City,North District,"No.325, Jinhua N. Rd., North Dist., Taichung City 404, Taiwan (R.O.C.)"
602,其他,統一超商北區進化北路豐華店(公話),404,臺中市,北區,臺中市北區進化北路148號,Others,"7-Eleven convenience store, Jinhua N. Rd., North Dist., Taichung City",Taichung City,North District,"No.148, Jinhua N. Rd., North Dist., Taichung City 404, Taiwan (R.O.C.)"
603,其他,統一超商北區進化北路永進店(公話),404,臺中市,北區,臺中市北區進化北路297號,Others,"7-Eleven convenience store,Jinhua N. Rd., North Dist., Taichung City",Taichung City,North District,"No.297, Jinhua N. Rd., North Dist., Taichung City 404, Taiwan (R.O.C.)"
604,其他,全家便利商店北區進化北路新大衛店(公話),404,臺中市,北區,臺中市北區進化北路365號之2,Others,"Family Mart convenience store,Jinhua N. Rd., North Dist., Taichung City ",Taichung City,North District,"No.365-2, Jinhua N. Rd., North Dist., Taichung City 404, Taiwan (R.O.C.)"
605,其他,統一超商北區進化北路衛道店(公話),404,臺中市,北區,臺中市北區進化北路378號之6,Others,"7-Eleven convenience store,Jinhua N. Rd., North Dist., Taichung City",Taichung City,North District,"No.378-6, Jinhua N. Rd., North Dist., Taichung City 404, Taiwan (R.O.C.)"
