項次,熱點類別,熱點名稱,郵遞區號,縣市名稱,鄉鎮市區,地址,熱點類別_英語,熱點名稱_英語,縣市名稱_英語,鄉鎮市區_英語,地址_英語
275,旅遊景點,臺中市太平樹孝商圈(樹孝路338號),411,臺中市,太平區,臺中市太平區樹孝路338號,Tourist Spots,"Taiping Shopping District(No.338, Shuxiao Rd.), Taichung City",Taichung City,Taiping District,"No.338, Shuxiao Rd., Taiping Dist., Taichung City 411, Taiwan (R.O.C.)"
276,旅遊景點,統一超商太平樹孝路育鑫店(公話),411,臺中市,太平區,臺中市太平區樹孝路488號,Tourist Spots,"7-Eleven convenience store, Shuxiao Rd., Taiping Dist., Taichung City ",Taichung City,Taiping District,"No.488, Shuxiao Rd., Taiping Dist., Taichung City 411, Taiwan (R.O.C.)"
277,旅遊景點,臺中市太平樹孝商圈(樹孝路25號),411,臺中市,太平區,臺中市太平區樹孝路25號,Tourist Spots,"Taiping Shopping District(No.25, Shuxiao Rd.), Taichung City",Taichung City,Taiping District,"No.25, Shuxiao Rd., Taiping Dist., Taichung City 411, Taiwan (R.O.C.)"
278,大眾運輸節點,全家便利商店烏日光日路烏日高鐵店(公話),414,臺中市,烏日區,臺中市烏日區光日路356號,Public Transportation,"Family Mart convenience store, Guangri Rd., Wuri Dist., Taichung City",Taichung City,Wuri District,"No.356, Guangri Rd., Wuri Dist., Taichung City 414, Taiwan (R.O.C.)"
279,大眾運輸節點,臺中市鐵路工會新泰安站(公話),421,臺中市,后里區,臺中市后里區安眉路37號之12,Public Transportation,"Taichung branch of the railway trade union in the new Tai'an station, Taichung City",Taichung City,Houli District,"No.37-12, Anmei Rd., Houli Dist., Taichung City 421, Taiwan (R.O.C.)"
280,旅遊景點,統一超商后里三豐路彩豐店(公話),421,臺中市,后里區,臺中市后里區三豐路473號之5,Tourist Spots,"7-Eleven convenience store, Sanfeng Rd., Houli Dist., Taichung City ",Taichung City,Houli District,"No.473-5, Sanfeng Rd., Houli Dist., Taichung City 421, Taiwan (R.O.C.)"
281,旅遊景點,臺中市豐原廟東復興商圈(中正路115號),420,臺中市,豐原區,臺中市豐原區中正路115號,Tourist Spots,"Fengyuan Shopping District(No.115, Zhongzheng Rd.), Taichung City",Taichung City,Fengyuan District,"No.115, Zhongzheng Rd., Fengyuan Dist., Taichung City 420, Taiwan (R.O.C.)"
282,旅遊景點,臺中市豐原廟東復興商圈(中正路172號),420,臺中市,豐原區,臺中市豐原區中正路172號,Tourist Spots,"Fengyuan Shopping District(No.172, Zhongzheng Rd.), Taichung City",Taichung City,Fengyuan District,"No.172, Zhongzheng Rd., Fengyuan Dist., Taichung City 420, Taiwan (R.O.C.)"
283,旅遊景點,統一超商豐原復興路復興店(公話),420,臺中市,豐原區,臺中市豐原區復興路75號,Tourist Spots,"7-Eleven convenience store, Fuxing Rd., Fengyuan Dist., Taichung City ",Taichung City,Fengyuan District,"No.75, Fuxing Rd., Fengyuan Dist., Taichung City 420, Taiwan (R.O.C.)"
284,旅遊景點,統一超商新社中興嶺中興嶺店(公話),426,臺中市,新社區,臺中市新社區中興里中興嶺170號之2,Tourist Spots,"7-Eleven convenience store, Zhongxingling, Xinshe Dist., Taichung City ",Taichung City,Xinshe District,"No.170-2, Zhongxingling, Xinshe Dist., Taichung City 426, Taiwan (R.O.C.)"
285,旅遊景點,新社魅力商圈(協中街158號),426,臺中市,新社區,臺中市新社區協中街158號,Tourist Spots,"Xinshe Shopping District(No.158, Xiezhong St.), Taichung City",Taichung City,Xinshe District,"No.158, Xiezhong St., Xinshe Dist., Taichung City 426, Taiwan (R.O.C.)"
286,旅遊景點,臺中市太平樹孝商圈(樹孝路308號)(公話),411,臺中市,太平區,臺中市太平區樹孝路308號,Tourist Spots,"Taiping Shopping District(No. 308, Shuxiao Rd.), Taichung City",Taichung City,Taiping District,"No.308, Shuxiao Rd., Taiping Dist., Taichung City 411, Taiwan (R.O.C.)"
287,旅遊景點,東勢區形象商圈(中山路42號),423,臺中市,東勢區,臺中市東勢區中山路42號,Tourist Spots,"Dongshi Shopping District(No.42, Zhongshan Rd.), Taichung City",Taichung City,Dongshi Dist,"No.42, Zhongshan Rd., Dongshi Dist., Taichung City 423, Taiwan (R.O.C.)"
288,旅遊景點,東勢區形象商圈(中新街西新巷88號之1)(公話亭),423,臺中市,東勢區,臺中市東勢區中新街西新巷88號之1,Tourist Spots,"Dongshi Shopping District(No. 88-1, Zhongxin St.), Taichung City",Taichung City,Dongshi Dist,"No. 88-1, Zhongxin St., Dongshi Dist., Taichung City 423, Taiwan (R.O.C.)"
289,旅遊景點,統一超商東勢第五橫街欣東雲店(公話),423,臺中市,東勢區,臺中市東勢區第五橫街28號,Tourist Spots,"7-Eleven convenience store, 5th Side St., Dongshi Dist., Taichung City ",Taichung City,Dongshi Dist,"No.28, 5th Side St., Dongshi Dist., Taichung City 423, Taiwan (R.O.C.)"
290,旅遊景點,和平谷關形象商圈(遊客中心),424,臺中市,和平區,臺中市和平區東關路一段102號,Tourist Spots,"Guguan Shopping District(Visitor Center), Taichung City",Taichung City,Heping District,"No.102, Sec. 1, Dongguan Rd., Heping Dist., Taichung City 424, Taiwan (R.O.C.)"
291,旅遊景點,東區東峰公園電亭(公話亭),401,臺中市,東區,臺中市東區七中路37號,Tourist Spots,Tong-Feng Park (telephone booth),Taichung City,East District,"No.37, Qizhong Rd., East Dist., Taichung City 401, Taiwan (R.O.C.)"
292,旅遊景點,全家便利商店和平東關路新谷關店(公話),424,臺中市,和平區,臺中市和平區東關路1段127號之1,Tourist Spots,"Family Mart convenience store, Sec. 1, Dongguan Rd., Heping Dist., Taichung City",Taichung City,Heping District,"No.127-1, Sec. 1, Dongguan Rd., Heping Dist., Taichung City 424, Taiwan (R.O.C.)"
293,旅遊景點,統一超商北屯昌平路昌平店(公話),406,臺中市,北屯區,臺中市北屯區昌平路一段70號,Tourist Spots,"7-Eleven convenience store, Changping Rd., Beitun Dist., Taichung City ",Taichung City,Beitun District,"No.70, Sec. 1, Changping Rd., Beitun Dist., Taichung City 406, Taiwan (R.O.C.)"
294,旅遊景點,臺中市昌平皮鞋商圈(兒童館),406,臺中市,北屯區,臺中市北屯區興安路1段162號,Tourist Spots,"Changping Shopping District(Children Museum), Taichung City",Taichung City,Beitun District,"No.162, Sec. 1, Xing’an Rd., Beitun Dist., Taichung City 406, Taiwan (R.O.C.)"
295,旅遊景點,統一超商中區公園路公園店(公話),400,臺中市,中區,臺中市中區公園路13號,Tourist Spots,"7-Eleven convenience store, Gongyuan Rd., Central Dist., Taichung City ",Taichung City,Central District,"No.13, Gongyuan Rd., Central Dist., Taichung City 400, Taiwan (R.O.C.)"
296,旅遊景點,臺中市自由路商圈(中山路96號),400,臺中市,中區,臺中市中區中山路96號,Tourist Spots,"Ziyou Shopping District(No.96, Zhongshan Rd.), Taichung City",Taichung City,Central District,"No.96, Zhongshan Rd., Central Dist., Taichung City 400, Taiwan (R.O.C.)"
297,旅遊景點,臺中市自由路商圈(自由路三段296號)(公話),401,臺中市,東區,臺中市東區自由路三段296號,Tourist Spots,"Ziyou Shopping District(No. 296, Sec. 3, Ziyou Rd.), Taichung City",Taichung City,East District,"No. 296, Sec. 3, Ziyou Rd., East Dist., Taichung City 401, Taiwan (R.O.C.)"
298,旅遊景點,臺中市逢甲商圈(逢甲路200巷1號),407,臺中市,西屯區,臺中市西屯區逢甲路200巷1號,Tourist Spots,"Fengjia Shopping District(No.1, Ln. 200, Fengjia Rd.), Taichung City",Taichung City,Xitun District,"No.1, Ln. 200, Fengjia Rd., Xitun Dist., Taichung City 407, Taiwan (R.O.C.)"
299,旅遊景點,全家便利商店西屯福星路福滿店(公話),407,臺中市,西屯區,臺中市西屯區福星路301號,Tourist Spots,"Family Mart convenience store, Fuxing Rd., Xitun Dist., Taichung City",Taichung City,Xitun District,"No.301, Fuxing Rd., Xitun Dist., Taichung City 407, Taiwan (R.O.C.)"
300,旅遊景點,OK超商西屯福星路福星店(公話),407,臺中市,西屯區,臺中市西屯區福星路327號,Tourist Spots,"OK mart convenience store, Fuxing Rd., Xitun Dist., Taichung City",Taichung City,Xitun District,"No.327, Fuxing Rd., Xitun Dist., Taichung City 407, Taiwan (R.O.C.)"
301,旅遊景點,全家便利商店西屯福星路好市店(公話),407,臺中市,西屯區,臺中市西屯區福星路330號之6,Tourist Spots,"Family Mart convenience store, Fuxing Rd., Xitun Dist., Taichung City",Taichung City,Xitun District,"No.330-6, Fuxing Rd., Xitun Dist., Taichung City 407, Taiwan (R.O.C.)"
302,旅遊景點,臺中市逢甲商圈(福興路330號),407,臺中市,西屯區,臺中市西屯區福星路330號,Tourist Spots,"Fengjia Shopping District(No.330, Fuxing Rd.), Taichung City",Taichung City,Xitun District,"No.330, Fuxing Rd., Xitun Dist., Taichung City 407, Taiwan (R.O.C.)"
303,旅遊景點,臺中市逢甲商圈(西安街277巷25弄5號),407,臺中市,西屯區,臺中市西屯區西安街277巷25弄5號,Tourist Spots,"Fengjia Shopping District(No.5, Aly. 25, Ln. 277, Xi'an St.), Taichung City",Taichung City,Xitun District,"No.5, Aly. 25, Ln. 277, Xi'an St., Xitun Dist., Taichung City 407, Taiwan (R.O.C.)"
304,旅遊景點,臺中市逢甲商圈(逢甲路198號之1),407,臺中市,西屯區,臺中市西屯區逢甲路198號之1,Tourist Spots,"Fengjia Shopping District(No. 198-1, Fengjia Rd.), Taichung City",Taichung City,Xitun District,"No.198-1, Fengjia Rd., Xitun Dist., Taichung City 407, Taiwan (R.O.C.)"
305,旅遊景點,統一超商西屯福星路逢大店(公話),407,臺中市,西屯區,臺中市西屯區福星路580號,Tourist Spots,"7-Eleven convenience store, Fuxing Rd., Xitun Dist., Taichung City ",Taichung City,Xitun District,"No.580, Fuxing Rd., Xitun Dist., Taichung City 407, Taiwan (R.O.C.)"
306,旅遊景點,臺中市逢甲商圈(逢甲路2號),407,臺中市,西屯區,臺中市西屯區西平里逢甲路2號,Tourist Spots,"Fengjia Shopping District(No.2, Fengjia Rd.), Taichung City",Taichung City,Xitun District,"No.2, Fengjia Rd., Xitun Dist., Taichung City 407, Taiwan (R.O.C.)"
307,旅遊景點,臺中市逢甲商圈(福興路427號),407,臺中市,西屯區,臺中市西屯區福星路427號,Tourist Spots,"Fengjia Shopping District(No.427, Fuxing Rd.), Taichung City",Taichung City,Xitun District,"No.427, Fuxing Rd., Xitun Dist., Taichung City 407, Taiwan (R.O.C.)"
308,旅遊景點,臺中市一中商圈(尊賢街11號),404,臺中市,北區,臺中市北區尊賢街11號,Tourist Spots,"Yizhong Shopping District(No.11, Zunxian St.), Taichung City",Taichung City,North District,"No.11, Zunxian St., North Dist., Taichung City 404, Taiwan (R.O.C.)"
309,旅遊景點,臺中市梧棲觀光漁港電信亭(公話),436,臺中市,清水區,臺中市清水區北堤路30號,Tourist Spots,Taichung City Wuci Fishing Port,Taichung City,Qingshui District,"No.30, Beiti Rd., Qingshui Dist., Taichung City 436, Taiwan (R.O.C.)"
310,旅遊景點,統一超商北區三民路新育才店(公話),404,臺中市,北區,臺中市北區三民路3段116號,Tourist Spots,"7-Eleven convenience store, Sec. 3, Sanmin Rd., North Dist., Taichung City ",Taichung City,North District,"No.116, Sec. 3, Sanmin Rd., North Dist., Taichung City 404, Taiwan (R.O.C.)"
311,旅遊景點,統一超商北區錦新路錦新店(公話),404,臺中市,北區,臺中市北區錦新街70號之2,Tourist Spots,"7-Eleven convenience store, Jinxin St., North Dist., Taichung City ",Taichung City,North District,"No.70-2, Jinxin St., North Dist., Taichung City 404, Taiwan (R.O.C.)"
312,旅遊景點,統一超商北區雙十路雙行店(公話),404,臺中市,北區,臺中市北區雙十路2段47號,Tourist Spots,"7-Eleven convenience store, Sec. 2, Shuangshi Rd., North Dist., Taichung City ",Taichung City,North District,"No.47, Sec. 2, Shuangshi Rd., North Dist., Taichung City 404, Taiwan (R.O.C.)"
313,旅遊景點,臺中市一中商圈(雙十路二段5號)(公話),404,臺中市,北區,臺中市北區雙十路二段5號,Tourist Spots,"Yizhong Shopping District(No. 5, Sec. 2, Shuangshi Rd.), Taichung City",Taichung City,North District,"No.5, Sec. 2, Shuangshi Rd., North Dist., Taichung City 404, Taiwan (R.O.C.)"
314,旅遊景點,統一超商中區建國路聯鑫店(公話),400,臺中市,中區,臺中市中區建國路145號,Tourist Spots,"7-Eleven convenience store, No. 145, Jianguo Rd., Central Dist., Taichung City",Taichung City,Central District,"No. 145, Jianguo Rd., Central Dist., Taichung City 400, Taiwan (R.O.C.)"
315,旅遊景點,全家便利商店北屯東山路培鶯店(公話),406,臺中市,北屯區,臺中市北屯區東山路2段51號之11,Tourist Spots,"Family Mart convenience store, Sec. 2, Dongshan Rd., Beitun Dist., Taichung City",Taichung City,Beitun District,"No.51-11, Sec. 2, Dongshan Rd., Beitun Dist., Taichung City 406, Taiwan (R.O.C.)"
316,旅遊景點,臺中市大坑商圈(東山路2段30號),406,臺中市,北屯區,臺中市北屯區東山路2段30號,Tourist Spots,"DaKeng Shopping District(No.30, Sec. 2, Dongshan Rd.), Taichung City",Taichung City,Beitun District,"No.30, Sec. 2, Dongshan Rd., Beitun Dist., Taichung City 406, Taiwan (R.O.C.)"
317,旅遊景點,統一超商北屯橫坑巷大坑店(公話),406,臺中市,北屯區,臺中市北屯區橫坑巷28號之1,Tourist Spots,"7-Eleven convenience store, Hengkeng Ln., Beitun Dist., Taichung City ",Taichung City,Beitun District,"No.28-1, Hengkeng Ln., Beitun Dist., Taichung City 406, Taiwan (R.O.C.)"
318,旅遊景點,統一超商北區天津路文津店(公話),404,臺中市,北區,臺中市北區天津路2段138號之11,Tourist Spots,"7-Eleven convenience store, Sec. 2, Tianjin Rd., North Dist., Taichung City ",Taichung City,North District,"No.138-11, Sec. 2, Tianjin Rd., North Dist., Taichung City 404, Taiwan (R.O.C.)"
319,旅遊景點,臺中市大坑商圈(東山路2段22號之1)(公話),406,臺中市,北屯區,臺中市北屯區東山路2段22號之1,Tourist Spots,"DaKeng Shopping District(No. 22-1, Sec. 2, Dongshan Rd.), Taichung City",Taichung City,Beitun District,"No.22-1, Sec. 2, Dongshan Rd., Beitun Dist., Taichung City 406, Taiwan (R.O.C.)"
320,旅遊景點,統一超商北區北平路新北平店,404,臺中市,北區,臺中市北區北平路二段96號,Tourist Spots,"7-Eleven convenience store, No. 96, Sec. 2, Beiping Rd., North Dist., Taichung City",Taichung City,North District,"No. 96, Sec. 2, Beiping Rd., North Dist., Taichung City 404, Taiwan (R.O.C.)"
321,旅遊景點,全家便利商店中區成功路繼成店(公話),400,臺中市,中區,臺中市中區成功路108號,Tourist Spots,"Family Mart convenience store, Chenggong Rd., Central Dist., Taichung City",Taichung City,Central District,"No.108, Chenggong Rd., Central Dist., Taichung City 400, Taiwan (R.O.C.)"
322,旅遊景點,臺中市繼光街商圈(綠川西街135號),400,臺中市,中區,臺中市中區綠川西街135號,Tourist Spots,"Jiguang Shopping District(No.135, Luchuan W. St.), Taichung City",Taichung City,Central District,"No.135, Luchuan W. St., Central Dist., Taichung City 400, Taiwan (R.O.C.)"
323,旅遊景點,臺中市大里中興商圈(中興路二段313號),412,臺中市,大里區,臺中市大里區中興路二段313號,Tourist Spots,"Dali Shopping District(No. 313, Sec. 2, Zhongxing Rd.), Taichung City",Taichung City,Dali District,"No. 313, Sec. 2, Zhongxing Rd., Dali Dist., Taichung City 412, Taiwan (R.O.C.)"
324,旅遊景點,臺中市繼光街商圈(繼光街124號),400,臺中市,中區,臺中市中區繼光街124號,Tourist Spots,"Jiguang Shopping District(No.124, Jiguang St.), Taichung City",Taichung City,Central District,"No.124, Jiguang St., Central Dist., Taichung City 400, Taiwan (R.O.C.)"
325,旅遊景點,臺中市電子街商圈(綠川西街119號),400,臺中市,中區,臺中市中區綠川西街119號,Tourist Spots,"Jiguang Shopping District(No.119, Luchuan W. St.), Taichung City",Taichung City,Central District,"No.103, Luchuan W. St., Central Dist., Taichung City 400, Taiwan (R.O.C.)"
326,旅遊景點,臺中市大隆路商圈(大隆路56號),407,臺中市,西屯區,臺中市西屯區大隆路56號,Tourist Spots,"Dalong Shopping District(No.56, Dalong Rd.), Taichung City",Taichung City,Xitun District,"No.56, Dalong Rd., Xitun Dist., Taichung City 407, Taiwan (R.O.C.)"
327,旅遊景點,臺中火車站周邊(建國路89號)(公話),400,臺中市,中區,臺中市中區建國路89號,Tourist Spots,"Surrounding of Taichung Train Station(No.89, Jianguo Rd.), Taichung City",Taichung City,Central District,"No.89, Jianguo Rd., Central Dist., Taichung City 400, Taiwan (R.O.C.)"
328,旅遊景點,臺中市繼中派出所(公話),400,臺中市,中區,臺中市中區中山路9號,Tourist Spots,"Jijhong Police station, Taichung City",Taichung City,Central District,"No.9, Zhongshan Rd., Central Dist., Taichung City 400, Taiwan (R.O.C.)"
329,旅遊景點,全家便利商店西屯文華路福氣店(公話),407,臺中市,西屯區,臺中市西屯區文華路105號,Tourist Spots,"Family Mart convenience store, Wenhua Rd., Xitun Dist., Taichung City",Taichung City,Xitun District,"No.105, Wenhua Rd., Xitun Dist., Taichung City 407, Taiwan (R.O.C.)"
330,大眾運輸節點,臺中火車站周邊(建國路216號),400,臺中市,中區,臺中市中區建國路216號,Public Transportation,"Surrounding of Taichung Train Station(No.216, Jianguo Rd.), Taichung City",Taichung City,Central District,"No.216, Jianguo Rd., Central Dist., Taichung City 400, Taiwan (R.O.C.)"
331,旅遊景點,全家便利商店中區中山路狀元店(公話),400,臺中市,中區,臺中市中區中山路19號,Tourist Spots,"Family Mart convenience store, Zhongshan Rd., Central Dist., Taichung City",Taichung City,Central District,"No.19, Zhongshan Rd., Central Dist., Taichung City 400, Taiwan (R.O.C.)"
332,旅遊景點,全家便利商店北區一中街一中讚店,404,臺中市,北區,臺中市北區一中街253號,Tourist Spots,"Family Mart convenience store, No.253, Yizhong St., North Dist., Taichung City",Taichung City,North District,"No.253, Yizhong St., North Dist., Taichung City 404, Taiwan (R.O.C.)"
333,大眾運輸節點,臺中市國光客運朝馬站(公話),407,臺中市,西屯區,臺中市西屯區朝富路8號,Public Transportation,"Kuokuang Bus Chaoma Station, Taichung City",Taichung City,Xitun District,"No.8, Chaofu Rd., Xitun Dist., Taichung City 407, Taiwan (R.O.C.)"
334,大眾運輸節點,臺中市統聯客運朝馬站(公話),407,臺中市,西屯區,臺中市西屯區潮洋里朝富路22號,Public Transportation,"United Hughway Bus Chaoma Station, Taichung City",Taichung City,Xitun District,"No.22, Chaofu Rd., Xitun Dist., Taichung City 407, Taiwan (R.O.C.)"
335,大眾運輸節點,臺中市統聯客運中港轉運站1(公話),407,臺中市,西屯區,臺中市西屯區臺灣大道四段637號,Public Transportation,"United Hughway Bus Taichung Port Station1, Taichung City",Taichung City,Xitun District,"No.637, Sec. 4, Taiwan Blvd., Xitun Dist., Taichung City 407, Taiwan (R.O.C.)"
336,大眾運輸節點,臺中市統聯客運中港轉運站2(公話),407,臺中市,西屯區,臺中市西屯區臺灣大道四段637號,Public Transportation,"United Hughway Bus Taichung Port Station2, Taichung City",Taichung City,Xitun District,"No.637, Sec. 4, Taiwan Blvd., Xitun Dist., Taichung City 407, Taiwan (R.O.C.)"
337,大眾運輸節點,臺中市國光客運水湳站(公話),406,臺中市,北屯區,臺中市北屯區中清路2段346號,Public Transportation,"Kuokuang Bus Shuinan Station, Taichung City",Taichung City,Beitun District,"No.346, Sec. 2, Zhongqing Rd., Beitun Dist., Taichung City 406, Taiwan (R.O.C.)"
338,大眾運輸節點,臺中市統聯客運水湳站(公話),406,臺中市,北屯區,臺中市北屯區中清路2段366號,Public Transportation,"United Hughway Bus Shuinan Station, Taichung City",Taichung City,Beitun District,"No.366, Sec. 2, Zhongqing Rd., Beitun Dist., Taichung City 406, Taiwan (R.O.C.)"
339,大眾運輸節點,臺中市豐客客運東勢站(公話),423,臺中市,東勢區,臺中市東勢區豐勢路488號,Public Transportation,"Fengyuan Bus Dongshi Station, Taichung City",Taichung City,Dongshi Dist,"No.488, Fengshi Rd., Dongshi Dist., Taichung City 423, Taiwan (R.O.C.)"
340,大眾運輸節點,臺中市豐原客運總站(公話),420,臺中市,豐原區,臺中市豐原區三民路46號,Public Transportation,"Fengyuan Bus Terminus, Taichung City",Taichung City,Fengyuan District,"No.46, Sanmin Rd., Fengyuan Dist., Taichung City 420, Taiwan (R.O.C.)"
341,大眾運輸節點,豐原葫蘆墩文化旅遊派出所前公話亭,420,臺中市,豐原區,臺中市豐原區中正路5號,Public Transportation,"Fengyuan Huludun Cultural Travel Police station, Taichung City",Taichung City,Fengyuan District,"No.5, Zhongzheng Rd., Fengyuan Dist., Taichung City 420, Taiwan (R.O.C.)"
342,大眾運輸節點,臺中市台鐵新烏日站(公話),414,臺中市,烏日區,臺中市烏日區高鐵東一路26號2樓,Public Transportation,"Taiwan Railways Administration New Wurih station, Taichung City",Taichung City,Wuri District,"2F., No.26, Gaotie E. 1st Rd., Wuri Dist., Taichung City 414, Taiwan (R.O.C.)"
343,大眾運輸節點,臺中市台鐵新烏日站台灣鐵道故事館(公話),414,臺中市,烏日區,臺中市烏日區高鐵東一路26號2樓,Public Transportation,"Taiwan Railway Story House, Taiwan Railways Administration New Wurih station , Taichung City",Taichung City,Wuri District,"2F., No.26, Gaotie E. 1st Rd., Wuri Dist., Taichung City 414, Taiwan (R.O.C.)"
344,大眾運輸節點,臺中市巨業客運沙鹿站(公話),433,臺中市,沙鹿區,臺中市沙鹿區和平街2號,Public Transportation,"Geya Bus Shalu Station, Taichung City",Taichung City,Shalu District,"No.2, Heping St., Shalu Dist., Taichung City 433, Taiwan (R.O.C.)"
345,大眾運輸節點,臺中市大甲火車站(公話),437,臺中市,大甲區,臺中市大甲區中山路一段828號,Public Transportation,"Dajia Train Station, Taichung City",Taichung City,Dajia District,"No.828, Sec. 1, Zhongshan Rd., Dajia Dist., Taichung City 437, Taiwan (R.O.C.)"
346,其他,全家便利商店大甲中山路鐵山店(公話),437,臺中市,大甲區,臺中市大甲區中山路1段1549號,Others,"Family Mart convenience store, Sec. 1, Zhongshan Rd., Dajia Dist., Taichung City",Taichung City,Dajia District,"No.1549, Sec. 1, Zhongshan Rd., Dajia Dist., Taichung City 437, Taiwan (R.O.C.)"
347,其他,統一超商大甲中山路義和店(公話),437,臺中市,大甲區,臺中市大甲區中山路1段492號,Others,"7-Eleven convenience store, Sec. 1, Zhongshan Rd., Dajia Dist., Taichung City ",Taichung City,Dajia District,"No.492, Sec. 1, Zhongshan Rd., Dajia Dist., Taichung City 437, Taiwan (R.O.C.)"
348,其他,全家便利商店大甲中山路車頭店(公話),437,臺中市,大甲區,臺中市大甲區中山路1段951號,Others,"Family Mart convenience store, Sec. 1, Zhongshan Rd., Dajia Dist., Taichung City ",Taichung City,Dajia District,"No.951, Sec. 1, Zhongshan Rd., Dajia Dist., Taichung City 437, Taiwan (R.O.C.)"
349,其他,全家便利商店大甲水源路甲中店(公話),437,臺中市,大甲區,臺中市大甲區水源路1號,Others,"Family Mart convenience store, Shuiyuan Rd., Dajia Dist., Taichung City ",Taichung City,Dajia District,"No.1, Shuiyuan Rd., Dajia Dist., Taichung City 437, Taiwan (R.O.C.)"
350,其他,全家便利商店大甲水源路水源店(公話),437,臺中市,大甲區,臺中市大甲區水源路450號,Others,"Family Mart convenience store, Shuiyuan Rd., Dajia Dist., Taichung City ",Taichung City,Dajia District,"No.450, Shuiyuan Rd., Dajia Dist., Taichung City 437, Taiwan (R.O.C.)"
351,其他,統一超商-大甲甲后路金甲后店(公話),437,臺中市,大甲區,臺中市大甲區甲后路8號,Others,"7-Eleven convenience store, Jiahou Rd., Dajia Dist., Taichung City ",Taichung City,Dajia District,"No.8, Jiahou Rd., Dajia Dist., Taichung City 437, Taiwan (R.O.C.)"
352,其他,統一超商大甲光明路媽祖店(公話),437,臺中市,大甲區,臺中市大甲區光明路1號,Others,"7-Eleven convenience store, Guangming Rd., Dajia Dist., Taichung City",Taichung City,Dajia District,"No.1, Guangming Rd., Dajia Dist., Taichung City 437, Taiwan (R.O.C.)"
353,其他,統一超商大甲順天路順天店(公話),437,臺中市,大甲區,臺中市大甲區順天路154號,Others,"7-Eleven convenience store, Shuntian Rd., Dajia Dist., Taichung City",Taichung City,Dajia District,"No.154, Shuntian Rd., Dajia Dist., Taichung City 437, Taiwan (R.O.C.)"
354,其他,統一超商大甲經國路新美店(公話),437,臺中市,大甲區,臺中市大甲區經國路329號,Others,"7-Eleven convenience store, Jingguo Rd., Dajia Dist., Taichung City",Taichung City,Dajia District,"No.329, Jingguo Rd., Dajia Dist., Taichung City 437, Taiwan (R.O.C.)"
355,其他,全家便利商店大安中山南路全盈店(公話),439,臺中市,大安區,臺中市大安區中山南路334號,Others,"Family Mart convenience store, Zhongshan S. Rd., Da’an Dist., Taichung City",Taichung City,Daan District,"No.334, Zhongshan S. Rd., Da’an Dist., Taichung City 439, Taiwan (R.O.C.)"
356,其他,全家便利商店大肚大明三街新市鎮店(公話),432,臺中市,大肚區,臺中市大肚區大明三街152號,Others,"Family Mart convenience store, Daming 3rd St., Dadu Dist., Taichung City",Taichung City,Dadu District,"No.152, Daming 3rd St., Dadu Dist., Taichung City 432, Taiwan (R.O.C.)"
357,其他,全家便利商店大肚大德三街高山店(公話),432,臺中市,大肚區,臺中市大肚區大德三街38號,Others,"Family Mart convenience store, Dade 3rd St., Dadu Dist., Taichung City",Taichung City,Dadu District,"No.38, Dade 3rd St., Dadu Dist., Taichung City 432, Taiwan (R.O.C.)"
